Xerox;Подача и захват бумаги;019K09470;Ролик отделения бумаги из кассеты;;;6076;
Xerox;Подача и захват бумаги;120E27851;Флажок датчика подачи бумаги;;;1575;xerox\120E27851.jpg
Xerox;Подача и захват бумаги;675K62874;Ролик подачи бумаги;;;2732;
Xerox;Внутренние компоненты;807E15100;Шестерня привода узла подачи бумаги;;;962;
Xerox;Узел переноса;676K05360;Модуль ксерографии, в сборе;;;23831;xerox\676K05360.jpg
Xerox;Электронные компоненты;097S03635;Модуль памяти 512Mb;;;22537;
Xerox;Электронные компоненты;097S03743;Модуль памяти 256Mb;;;5117;
Xerox;Электронные компоненты;848K09303;Панель управления, в сборе;;;;
Xerox;Узел термозакрепления;675K65665;Печь, в сборе;220В;;28693;
