Brother;Узел автоматической подачи оригиналов;LEN202001;Узел автоматической подачи документов, в сборе;;;16031;
Brother;Подача и захват бумаги;LY7750001;Кассета на 250 листов, в сборе;лоток 2;;3989;brother\LY7750001.jpg
Brother;Внутренние компоненты;LY7841001;Фильтр тонера;;;1699;brother\LY7841001.jpg
Brother;Электронные компоненты;LU6918001;Блок лазера;;;34204;brother\LU6918001.jpg
Brother;Электронные компоненты;LEN205001;Планшетный сканер, в сборе;;;18247;
Brother;Электронные компоненты;LT3225001;Сканирующая линейка планшетного сканера;;;5171;
Brother;Узел термозакрепления;LY0233001;Шестерня привода узла термозакрепления;25 зубов;;259;
Brother;Детали корпуса;LX4939001;Крышка; (основание) узла автоматической подачи документов;;3251;
